[INFO] Scanning for projects...
[WARNING] 
[WARNING] Some problems were encountered while building the effective model for anujpal:PurchaseAProductEnd-To-End:jar:0.0.1-SNAPSHOT
[WARNING] 'build.pluginManagement.plugins.plugin.(groupId:artifactId)' must be unique but found duplicate declaration of plugin org.apache.maven.plugins:maven-surefire-plugin @ line 152, column 17
[WARNING] 
[WARNING] It is highly recommended to fix these problems because they threaten the stability of your build.
[WARNING] 
[WARNING] For this reason, future Maven versions might no longer support building such malformed projects.
[WARNING] 
[INFO] 
[INFO] -----------------< anujpal:PurchaseAProductEnd-To-End >-----------------
[INFO] Building PurchaseAProductEnd-To-End 0.0.1-SNAPSHOT
[INFO]   from pom.xml
[INFO] --------------------------------[ jar ]---------------------------------
[INFO] 
[INFO] --- resources:3.3.1:resources (default-resources) @ PurchaseAProductEnd-To-End ---
[INFO] skip non existing resourceDirectory E:\Udemy Selenium New Start 22_10_2024\Workspace\PurchaseAProductEnd-To-End\src\main\resources
[INFO] 
[INFO] --- compiler:3.13.0:compile (default-compile) @ PurchaseAProductEnd-To-End ---
[INFO] Nothing to compile - all classes are up to date.
[INFO] 
[INFO] --- resources:3.3.1:testResources (default-testResources) @ PurchaseAProductEnd-To-End ---
[INFO] skip non existing resourceDirectory E:\Udemy Selenium New Start 22_10_2024\Workspace\PurchaseAProductEnd-To-End\src\test\resources
[INFO] 
[INFO] --- compiler:3.13.0:testCompile (default-testCompile) @ PurchaseAProductEnd-To-End ---
[INFO] Recompiling the module because of added or removed source files.
[INFO] Compiling 6 source files with javac [debug release 17] to target\test-classes
[INFO] 
[INFO] --- surefire:3.5.3:test (default-test) @ PurchaseAProductEnd-To-End ---
Downloading from central: https://repo.maven.apache.org/maven2/org/apache/maven/surefire/surefire-api/3.5.3/surefire-api-3.5.3.pom
Progress (1): 1.4/3.7 kBProgress (1): 2.8/3.7 kBProgress (1): 3.7 kB                        Downloaded from central: https://repo.maven.apache.org/maven2/org/apache/maven/surefire/surefire-api/3.5.3/surefire-api-3.5.3.pom (3.7 kB at 7.5 kB/s)
Downloading from central: https://repo.maven.apache.org/maven2/org/apache/maven/surefire/surefire-logger-api/3.5.3/surefire-logger-api-3.5.3.pom
Progress (1): 1.4/3.5 kBProgress (1): 2.8/3.5 kBProgress (1): 3.5 kB                        Downloaded from central: https://repo.maven.apache.org/maven2/org/apache/maven/surefire/surefire-logger-api/3.5.3/surefire-logger-api-3.5.3.pom (3.5 kB at 64 kB/s)
Downloading from central: https://repo.maven.apache.org/maven2/org/apache/maven/surefire/surefire-shared-utils/3.5.3/surefire-shared-utils-3.5.3.pom
Progress (1): 1.4/4.0 kBProgress (1): 2.8/4.0 kBProgress (1): 4.0 kB                        Downloaded from central: https://repo.maven.apache.org/maven2/org/apache/maven/surefire/surefire-shared-utils/3.5.3/surefire-shared-utils-3.5.3.pom (4.0 kB at 84 kB/s)
Downloading from central: https://repo.maven.apache.org/maven2/org/apache/maven/surefire/surefire-extensions-api/3.5.3/surefire-extensions-api-3.5.3.pom
Progress (1): 1.4/3.6 kBProgress (1): 2.8/3.6 kBProgress (1): 3.6 kB                        Downloaded from central: https://repo.maven.apache.org/maven2/org/apache/maven/surefire/surefire-extensions-api/3.5.3/surefire-extensions-api-3.5.3.pom (3.6 kB at 137 kB/s)
Downloading from central: https://repo.maven.apache.org/maven2/org/apache/maven/surefire/maven-surefire-common/3.5.3/maven-surefire-common-3.5.3.pom
Progress (1): 1.4/7.8 kBProgress (1): 2.8/7.8 kBProgress (1): 4.1/7.8 kBProgress (1): 5.5/7.8 kBProgress (1): 6.9/7.8 kBProgress (1): 7.8 kB                        Downloaded from central: https://repo.maven.apache.org/maven2/org/apache/maven/surefire/maven-surefire-common/3.5.3/maven-surefire-common-3.5.3.pom (7.8 kB at 231 kB/s)
Downloading from central: https://repo.maven.apache.org/maven2/org/apache/maven/surefire/surefire-booter/3.5.3/surefire-booter-3.5.3.pom
Progress (1): 1.4/5.0 kBProgress (1): 2.8/5.0 kBProgress (1): 4.1/5.0 kBProgress (1): 5.0 kB                        Downloaded from central: https://repo.maven.apache.org/maven2/org/apache/maven/surefire/surefire-booter/3.5.3/surefire-booter-3.5.3.pom (5.0 kB at 146 kB/s)
Downloading from central: https://repo.maven.apache.org/maven2/org/apache/maven/surefire/surefire-extensions-spi/3.5.3/surefire-extensions-spi-3.5.3.pom
Progress (1): 1.4/1.7 kBProgress (1): 1.7 kB                        Downloaded from central: https://repo.maven.apache.org/maven2/org/apache/maven/surefire/surefire-extensions-spi/3.5.3/surefire-extensions-spi-3.5.3.pom (1.7 kB at 50 kB/s)
Downloading from central: https://repo.maven.apache.org/maven2/org/codehaus/plexus/plexus-java/1.4.0/plexus-java-1.4.0.pom
Progress (1): 1.4/4.1 kBProgress (1): 2.8/4.1 kBProgress (1): 4.1 kB                        Downloaded from central: https://repo.maven.apache.org/maven2/org/codehaus/plexus/plexus-java/1.4.0/plexus-java-1.4.0.pom (4.1 kB at 141 kB/s)
Downloading from central: https://repo.maven.apache.org/maven2/org/codehaus/plexus/plexus-languages/1.4.0/plexus-languages-1.4.0.pom
Progress (1): 1.4/3.9 kBProgress (1): 2.8/3.9 kBProgress (1): 3.9 kB                        Downloaded from central: https://repo.maven.apache.org/maven2/org/codehaus/plexus/plexus-languages/1.4.0/plexus-languages-1.4.0.pom (3.9 kB at 129 kB/s)
Downloading from central: https://repo.maven.apache.org/maven2/org/codehaus/plexus/plexus/20/plexus-20.pom
Progress (1): 1.4/29 kBProgress (1): 2.8/29 kBProgress (1): 4.1/29 kBProgress (1): 5.5/29 kBProgress (1): 6.9/29 kBProgress (1): 8.3/29 kBProgress (1): 9.7/29 kBProgress (1): 11/29 kB Progress (1): 12/29 kBProgress (1): 14/29 kBProgress (1): 15/29 kBProgress (1): 24/29 kBProgress (1): 29 kB                      Downloaded from central: https://repo.maven.apache.org/maven2/org/codehaus/plexus/plexus/20/plexus-20.pom (29 kB at 748 kB/s)
Downloading from central: https://repo.maven.apache.org/maven2/org/ow2/asm/asm/9.7.1/asm-9.7.1.pom
Progress (1): 2.4 kB                    Downloaded from central: https://repo.maven.apache.org/maven2/org/ow2/asm/asm/9.7.1/asm-9.7.1.pom (2.4 kB at 85 kB/s)
Downloading from central: https://repo.maven.apache.org/maven2/com/thoughtworks/qdox/qdox/2.2.0/qdox-2.2.0.pom
Progress (1): 16/18 kBProgress (1): 18 kB                      Downloaded from central: https://repo.maven.apache.org/maven2/com/thoughtworks/qdox/qdox/2.2.0/qdox-2.2.0.pom (18 kB at 353 kB/s)
Downloading from central: https://repo.maven.apache.org/maven2/org/apache/maven/surefire/surefire-api/3.5.3/surefire-api-3.5.3.jar
Progress (1): 16/172 kBProgress (1): 33/172 kBProgress (1): 49/172 kBProgress (1): 66/172 kBProgress (1): 82/172 kBProgress (1): 98/172 kBProgress (1): 115/172 kBProgress (1): 131/172 kBProgress (1): 147/172 kBProgress (1): 164/172 kBProgress (1): 172 kB                        Downloaded from central: https://repo.maven.apache.org/maven2/org/apache/maven/surefire/surefire-api/3.5.3/surefire-api-3.5.3.jar (172 kB at 2.7 MB/s)
Downloading from central: https://repo.maven.apache.org/maven2/org/apache/maven/surefire/surefire-logger-api/3.5.3/surefire-logger-api-3.5.3.jar
Downloading from central: https://repo.maven.apache.org/maven2/org/apache/maven/surefire/surefire-shared-utils/3.5.3/surefire-shared-utils-3.5.3.jar
Downloading from central: https://repo.maven.apache.org/maven2/org/apache/maven/surefire/maven-surefire-common/3.5.3/maven-surefire-common-3.5.3.jar
Downloading from central: https://repo.maven.apache.org/maven2/org/apache/maven/surefire/surefire-booter/3.5.3/surefire-booter-3.5.3.jar
Progress (1): 14 kB                   Downloaded from central: https://repo.maven.apache.org/maven2/org/apache/maven/surefire/surefire-logger-api/3.5.3/surefire-logger-api-3.5.3.jar (14 kB at 425 kB/s)
Downloading from central: https://repo.maven.apache.org/maven2/org/apache/maven/surefire/surefire-extensions-spi/3.5.3/surefire-extensions-spi-3.5.3.jar
Downloading from central: https://repo.maven.apache.org/maven2/org/apache/maven/surefire/surefire-extensions-api/3.5.3/surefire-extensions-api-3.5.3.jar
Progress (1): 0/2.9 MBProgress (1): 0/2.9 MBProgress (2): 0/2.9 MB | 8.2 kBProgress (2): 0/2.9 MB | 8.2 kBProgress (2): 0/2.9 MB | 8.2 kBProgress (2): 0/2.9 MB | 8.2 kBProgress (2): 0/2.9 MB | 8.2 kBProgress (2): 0/2.9 MB | 8.2 kBProgress (2): 0/2.9 MB | 8.2 kBProgress (2): 0/2.9 MB | 8.2 kBProgress (2): 0/2.9 MB | 8.2 kBProgress (2): 0/2.9 MB | 8.2 kBProgress (2): 0/2.9 MB | 8.2 kBProgress (2): 0/2.9 MB | 8.2 kBProgress (2): 0/2.9 MB | 8.2 kBProgress (2): 0/2.9 MB | 8.2 kBProgress (3): 0/2.9 MB | 8.2 kB | 1.4/118 kBProgress (3): 0/2.9 MB | 8.2 kB | 2.8/118 kBProgress (3): 0/2.9 MB | 8.2 kB | 4.1/118 kBProgress (3): 0/2.9 MB | 8.2 kB | 5.5/118 kBProgress (3): 0/2.9 MB | 8.2 kB | 6.9/118 kBProgress (3): 0/2.9 MB | 8.2 kB | 8.3/118 kBProgress (3): 0/2.9 MB | 8.2 kB | 9.7/118 kBProgress (3): 0/2.9 MB | 8.2 kB | 11/118 kB Progress (3): 0/2.9 MB | 8.2 kB | 12/118 kBProgress (3): 0/2.9 MB | 8.2 kB | 14/118 kBProgress (3): 0/2.9 MB | 8.2 kB | 15/118 kBProgress (3): 0/2.9 MB | 8.2 kB | 16/118 kB                                           Downloaded from central: https://repo.maven.apache.org/maven2/org/apache/maven/surefire/surefire-extensions-spi/3.5.3/surefire-extensions-spi-3.5.3.jar (8.2 kB at 77 kB/s)
Downloading from central: https://repo.maven.apache.org/maven2/org/codehaus/plexus/plexus-java/1.4.0/plexus-java-1.4.0.jar
Progress (2): 0/2.9 MB | 16/118 kBProgress (2): 0/2.9 MB | 16/118 kBProgress (2): 0/2.9 MB | 32/118 kBProgress (2): 0/2.9 MB | 32/118 kBProgress (2): 0/2.9 MB | 32/118 kBProgress (2): 0/2.9 MB | 32/118 kBProgress (2): 0/2.9 MB | 32/118 kBProgress (2): 0/2.9 MB | 32/118 kBProgress (2): 0/2.9 MB | 49/118 kBProgress (2): 0/2.9 MB | 49/118 kBProgress (3): 0/2.9 MB | 49/118 kB | 1.4/26 kBProgress (3): 0/2.9 MB | 49/118 kB | 2.8/26 kBProgress (3): 0/2.9 MB | 49/118 kB | 2.8/26 kBProgress (3): 0/2.9 MB | 49/118 kB | 2.8/26 kBProgress (3): 0/2.9 MB | 65/118 kB | 2.8/26 kBProgress (4): 0/2.9 MB | 65/118 kB | 2.8/26 kB | 16/57 kBProgress (4): 0/2.9 MB | 65/118 kB | 4.1/26 kB | 16/57 kBProgress (4): 0/2.9 MB | 65/118 kB | 5.5/26 kB | 16/57 kBProgress (4): 0/2.9 MB | 65/118 kB | 6.9/26 kB | 16/57 kBProgress (5): 0/2.9 MB | 65/118 kB | 6.9/26 kB | 16/57 kB | 1.4/312 kBProgress (5): 0/2.9 MB | 65/118 kB | 6.9/26 kB | 16/57 kB | 2.8/312 kBProgress (5): 0/2.9 MB | 65/118 kB | 6.9/26 kB | 16/57 kB | 4.1/312 kBProgress (5): 0/2.9 MB | 65/118 kB | 6.9/26 kB | 16/57 kB | 5.5/312 kBProgress (5): 0/2.9 MB | 65/118 kB | 6.9/26 kB | 16/57 kB | 6.9/312 kBProgress (5): 0/2.9 MB | 65/118 kB | 6.9/26 kB | 16/57 kB | 8.3/312 kBProgress (5): 0/2.9 MB | 65/118 kB | 8.3/26 kB | 16/57 kB | 8.3/312 kBProgress (5): 0/2.9 MB | 65/118 kB | 9.7/26 kB | 16/57 kB | 8.3/312 kBProgress (5): 0/2.9 MB | 65/118 kB | 11/26 kB | 16/57 kB | 8.3/312 kB Progress (5): 0/2.9 MB | 65/118 kB | 12/26 kB | 16/57 kB | 8.3/312 kBProgress (5): 0/2.9 MB | 65/118 kB | 14/26 kB | 16/57 kB | 8.3/312 kBProgress (5): 0/2.9 MB | 65/118 kB | 15/26 kB | 16/57 kB | 8.3/312 kBProgress (5): 0/2.9 MB | 65/118 kB | 17/26 kB | 16/57 kB | 8.3/312 kBProgress (5): 0/2.9 MB | 65/118 kB | 18/26 kB | 16/57 kB | 8.3/312 kBProgress (5): 0/2.9 MB | 65/118 kB | 19/26 kB | 16/57 kB | 8.3/312 kBProgress (5): 0/2.9 MB | 65/118 kB | 21/26 kB | 16/57 kB | 8.3/312 kBProgress (5): 0/2.9 MB | 65/118 kB | 22/26 kB | 16/57 kB | 8.3/312 kBProgress (5): 0/2.9 MB | 81/118 kB | 22/26 kB | 16/57 kB | 8.3/312 kBProgress (5): 0/2.9 MB | 81/118 kB | 23/26 kB | 16/57 kB | 8.3/312 kBProgress (5): 0/2.9 MB | 98/118 kB | 23/26 kB | 16/57 kB | 8.3/312 kBProgress (5): 0.1/2.9 MB | 98/118 kB | 23/26 kB | 16/57 kB | 8.3/312 kBProgress (5): 0.1/2.9 MB | 98/118 kB | 23/26 kB | 32/57 kB | 8.3/312 kBProgress (5): 0.1/2.9 MB | 98/118 kB | 23/26 kB | 32/57 kB | 9.7/312 kBProgress (5): 0.1/2.9 MB | 98/118 kB | 23/26 kB | 32/57 kB | 11/312 kB Progress (5): 0.1/2.9 MB | 98/118 kB | 23/26 kB | 32/57 kB | 12/312 kBProgress (5): 0.1/2.9 MB | 98/118 kB | 23/26 kB | 32/57 kB | 14/312 kBProgress (5): 0.1/2.9 MB | 98/118 kB | 23/26 kB | 32/57 kB | 15/312 kBProgress (5): 0.1/2.9 MB | 98/118 kB | 23/26 kB | 32/57 kB | 16/312 kBProgress (5): 0.1/2.9 MB | 98/118 kB | 23/26 kB | 32/57 kB | 32/312 kBProgress (5): 0.1/2.9 MB | 98/118 kB | 23/26 kB | 32/57 kB | 49/312 kBProgress (5): 0.1/2.9 MB | 98/118 kB | 23/26 kB | 32/57 kB | 49/312 kBProgress (5): 0.1/2.9 MB | 114/118 kB | 23/26 kB | 32/57 kB | 49/312 kBProgress (5): 0.1/2.9 MB | 118 kB | 23/26 kB | 32/57 kB | 49/312 kB    Progress (5): 0.1/2.9 MB | 118 kB | 23/26 kB | 49/57 kB | 49/312 kBProgress (5): 0.1/2.9 MB | 118 kB | 25/26 kB | 49/57 kB | 49/312 kBProgress (5): 0.1/2.9 MB | 118 kB | 26 kB | 49/57 kB | 49/312 kB   Progress (5): 0.1/2.9 MB | 118 kB | 26 kB | 57 kB | 49/312 kB   Progress (5): 0.1/2.9 MB | 118 kB | 26 kB | 57 kB | 49/312 kBProgress (5): 0.1/2.9 MB | 118 kB | 26 kB | 57 kB | 65/312 kBProgress (5): 0.1/2.9 MB | 118 kB | 26 kB | 57 kB | 81/312 kBProgress (5): 0.1/2.9 MB | 118 kB | 26 kB | 57 kB | 98/312 kBProgress (5): 0.1/2.9 MB | 118 kB | 26 kB | 57 kB | 114/312 kBProgress (5): 0.1/2.9 MB | 118 kB | 26 kB | 57 kB | 131/312 kBProgress (5): 0.1/2.9 MB | 118 kB | 26 kB | 57 kB | 131/312 kBProgress (5): 0.1/2.9 MB | 118 kB | 26 kB | 57 kB | 147/312 kBProgress (5): 0.1/2.9 MB | 118 kB | 26 kB | 57 kB | 147/312 kBProgress (5): 0.1/2.9 MB | 118 kB | 26 kB | 57 kB | 163/312 kBProgress (5): 0.1/2.9 MB | 118 kB | 26 kB | 57 kB | 163/312 kB                                                              Downloaded from central: https://repo.maven.apache.org/maven2/org/apache/maven/surefire/surefire-extensions-api/3.5.3/surefire-extensions-api-3.5.3.jar (26 kB at 108 kB/s)
Progress (4): 0.1/2.9 MB | 118 kB | 57 kB | 180/312 kB                                                      Downloading from central: https://repo.maven.apache.org/maven2/org/ow2/asm/asm/9.7.1/asm-9.7.1.jar
Downloaded from central: https://repo.maven.apache.org/maven2/org/codehaus/plexus/plexus-java/1.4.0/plexus-java-1.4.0.jar (57 kB at 238 kB/s)
Progress (3): 0.1/2.9 MB | 118 kB | 196/312 kBProgress (3): 0.1/2.9 MB | 118 kB | 212/312 kBProgress (3): 0.1/2.9 MB | 118 kB | 229/312 kB                                              Downloading from central: https://repo.maven.apache.org/maven2/com/thoughtworks/qdox/qdox/2.2.0/qdox-2.2.0.jar
Progress (3): 0.1/2.9 MB | 118 kB | 245/312 kBProgress (3): 0.1/2.9 MB | 118 kB | 262/312 kBProgress (3): 0.1/2.9 MB | 118 kB | 278/312 kBProgress (3): 0.1/2.9 MB | 118 kB | 294/312 kBProgress (3): 0.1/2.9 MB | 118 kB | 311/312 kBProgress (3): 0.1/2.9 MB | 118 kB | 312 kB    Progress (3): 0.2/2.9 MB | 118 kB | 312 kBProgress (3): 0.2/2.9 MB | 118 kB | 312 kBProgress (4): 0.2/2.9 MB | 118 kB | 312 kB | 16/126 kBProgress (4): 0.2/2.9 MB | 118 kB | 312 kB | 16/126 kBProgress (4): 0.2/2.9 MB | 118 kB | 312 kB | 16/126 kBProgress (4): 0.2/2.9 MB | 118 kB | 312 kB | 32/126 kBProgress (4): 0.2/2.9 MB | 118 kB | 312 kB | 32/126 kBProgress (4): 0.2/2.9 MB | 118 kB | 312 kB | 49/126 kBProgress (4): 0.2/2.9 MB | 118 kB | 312 kB | 49/126 kBProgress (4): 0.2/2.9 MB | 118 kB | 312 kB | 65/126 kBProgress (4): 0.2/2.9 MB | 118 kB | 312 kB | 81/126 kBProgress (4): 0.2/2.9 MB | 118 kB | 312 kB | 98/126 kBProgress (4): 0.2/2.9 MB | 118 kB | 312 kB | 114/126 kBProgress (4): 0.2/2.9 MB | 118 kB | 312 kB | 126 kB    Progress (4): 0.3/2.9 MB | 118 kB | 312 kB | 126 kBProgress (4): 0.3/2.9 MB | 118 kB | 312 kB | 126 kBProgress (4): 0.3/2.9 MB | 118 kB | 312 kB | 126 kBProgress (5): 0.3/2.9 MB | 118 kB | 312 kB | 126 kB | 16/353 kBProgress (5): 0.3/2.9 MB | 118 kB | 312 kB | 126 kB | 33/353 kBProgress (5): 0.3/2.9 MB | 118 kB | 312 kB | 126 kB | 49/353 kB                                                               Downloaded from central: https://repo.maven.apache.org/maven2/org/ow2/asm/asm/9.7.1/asm-9.7.1.jar (126 kB at 446 kB/s)
Progress (4): 0.3/2.9 MB | 118 kB | 312 kB | 49/353 kBProgress (4): 0.3/2.9 MB | 118 kB | 312 kB | 49/353 kBProgress (4): 0.3/2.9 MB | 118 kB | 312 kB | 49/353 kBProgress (4): 0.4/2.9 MB | 118 kB | 312 kB | 49/353 kBProgress (4): 0.4/2.9 MB | 118 kB | 312 kB | 49/353 kB                                                      Downloaded from central: https://repo.maven.apache.org/maven2/org/apache/maven/surefire/maven-surefire-common/3.5.3/maven-surefire-common-3.5.3.jar (312 kB at 1.1 MB/s)
Progress (3): 0.4/2.9 MB | 118 kB | 49/353 kB                                             Downloaded from central: https://repo.maven.apache.org/maven2/org/apache/maven/surefire/surefire-booter/3.5.3/surefire-booter-3.5.3.jar (118 kB at 404 kB/s)
Progress (2): 0.4/2.9 MB | 49/353 kBProgress (2): 0.4/2.9 MB | 66/353 kBProgress (2): 0.4/2.9 MB | 66/353 kBProgress (2): 0.4/2.9 MB | 82/353 kBProgress (2): 0.4/2.9 MB | 82/353 kBProgress (2): 0.4/2.9 MB | 98/353 kBProgress (2): 0.5/2.9 MB | 98/353 kBProgress (2): 0.5/2.9 MB | 115/353 kBProgress (2): 0.5/2.9 MB | 115/353 kBProgress (2): 0.5/2.9 MB | 131/353 kBProgress (2): 0.5/2.9 MB | 147/353 kBProgress (2): 0.5/2.9 MB | 164/353 kBProgress (2): 0.5/2.9 MB | 180/353 kBProgress (2): 0.5/2.9 MB | 180/353 kBProgress (2): 0.5/2.9 MB | 180/353 kBProgress (2): 0.5/2.9 MB | 180/353 kBProgress (2): 0.5/2.9 MB | 180/353 kBProgress (2): 0.5/2.9 MB | 197/353 kBProgress (2): 0.6/2.9 MB | 197/353 kBProgress (2): 0.6/2.9 MB | 213/353 kBProgress (2): 0.6/2.9 MB | 213/353 kBProgress (2): 0.6/2.9 MB | 213/353 kBProgress (2): 0.6/2.9 MB | 213/353 kBProgress (2): 0.6/2.9 MB | 213/353 kBProgress (2): 0.6/2.9 MB | 213/353 kBProgress (2): 0.7/2.9 MB | 213/353 kBProgress (2): 0.7/2.9 MB | 213/353 kBProgress (2): 0.7/2.9 MB | 229/353 kBProgress (2): 0.7/2.9 MB | 229/353 kBProgress (2): 0.7/2.9 MB | 229/353 kBProgress (2): 0.7/2.9 MB | 229/353 kBProgress (2): 0.7/2.9 MB | 246/353 kBProgress (2): 0.7/2.9 MB | 246/353 kBProgress (2): 0.7/2.9 MB | 262/353 kBProgress (2): 0.8/2.9 MB | 262/353 kBProgress (2): 0.8/2.9 MB | 279/353 kBProgress (2): 0.8/2.9 MB | 279/353 kBProgress (2): 0.8/2.9 MB | 279/353 kBProgress (2): 0.8/2.9 MB | 279/353 kBProgress (2): 0.8/2.9 MB | 279/353 kBProgress (2): 0.8/2.9 MB | 279/353 kBProgress (2): 0.9/2.9 MB | 279/353 kBProgress (2): 0.9/2.9 MB | 279/353 kBProgress (2): 0.9/2.9 MB | 295/353 kBProgress (2): 0.9/2.9 MB | 295/353 kBProgress (2): 0.9/2.9 MB | 295/353 kBProgress (2): 0.9/2.9 MB | 311/353 kBProgress (2): 0.9/2.9 MB | 311/353 kBProgress (2): 0.9/2.9 MB | 311/353 kBProgress (2): 1.0/2.9 MB | 311/353 kBProgress (2): 1.0/2.9 MB | 311/353 kBProgress (2): 1.0/2.9 MB | 328/353 kBProgress (2): 1.0/2.9 MB | 328/353 kBProgress (2): 1.0/2.9 MB | 328/353 kBProgress (2): 1.0/2.9 MB | 328/353 kBProgress (2): 1.0/2.9 MB | 328/353 kBProgress (2): 1.0/2.9 MB | 328/353 kBProgress (2): 1.0/2.9 MB | 344/353 kBProgress (2): 1.1/2.9 MB | 344/353 kBProgress (2): 1.1/2.9 MB | 344/353 kBProgress (2): 1.1/2.9 MB | 344/353 kBProgress (2): 1.1/2.9 MB | 353 kB    Progress (2): 1.1/2.9 MB | 353 kBProgress (2): 1.1/2.9 MB | 353 kBProgress (2): 1.1/2.9 MB | 353 kBProgress (2): 1.2/2.9 MB | 353 kBProgress (2): 1.2/2.9 MB | 353 kBProgress (2): 1.2/2.9 MB | 353 kBProgress (2): 1.2/2.9 MB | 353 kBProgress (2): 1.2/2.9 MB | 353 kBProgress (2): 1.2/2.9 MB | 353 kBProgress (2): 1.3/2.9 MB | 353 kB                                 Downloaded from central: https://repo.maven.apache.org/maven2/com/thoughtworks/qdox/qdox/2.2.0/qdox-2.2.0.jar (353 kB at 949 kB/s)
Progress (1): 1.3/2.9 MBProgress (1): 1.3/2.9 MBProgress (1): 1.3/2.9 MBProgress (1): 1.3/2.9 MBProgress (1): 1.3/2.9 MBProgress (1): 1.4/2.9 MBProgress (1): 1.4/2.9 MBProgress (1): 1.4/2.9 MBProgress (1): 1.4/2.9 MBProgress (1): 1.4/2.9 MBProgress (1): 1.4/2.9 MBProgress (1): 1.5/2.9 MBProgress (1): 1.5/2.9 MBProgress (1): 1.5/2.9 MBProgress (1): 1.5/2.9 MBProgress (1): 1.5/2.9 MBProgress (1): 1.5/2.9 MBProgress (1): 1.6/2.9 MBProgress (1): 1.6/2.9 MBProgress (1): 1.6/2.9 MBProgress (1): 1.6/2.9 MBProgress (1): 1.6/2.9 MBProgress (1): 1.6/2.9 MBProgress (1): 1.7/2.9 MBProgress (1): 1.7/2.9 MBProgress (1): 1.7/2.9 MBProgress (1): 1.7/2.9 MBProgress (1): 1.7/2.9 MBProgress (1): 1.7/2.9 MBProgress (1): 1.8/2.9 MBProgress (1): 1.8/2.9 MBProgress (1): 1.8/2.9 MBProgress (1): 1.8/2.9 MBProgress (1): 1.8/2.9 MBProgress (1): 1.8/2.9 MBProgress (1): 1.9/2.9 MBProgress (1): 1.9/2.9 MBProgress (1): 1.9/2.9 MBProgress (1): 1.9/2.9 MBProgress (1): 1.9/2.9 MBProgress (1): 1.9/2.9 MBProgress (1): 1.9/2.9 MBProgress (1): 2.0/2.9 MBProgress (1): 2.0/2.9 MBProgress (1): 2.0/2.9 MBProgress (1): 2.0/2.9 MBProgress (1): 2.0/2.9 MBProgress (1): 2.0/2.9 MBProgress (1): 2.1/2.9 MBProgress (1): 2.1/2.9 MBProgress (1): 2.1/2.9 MBProgress (1): 2.1/2.9 MBProgress (1): 2.1/2.9 MBProgress (1): 2.1/2.9 MBProgress (1): 2.2/2.9 MBProgress (1): 2.2/2.9 MBProgress (1): 2.2/2.9 MBProgress (1): 2.2/2.9 MBProgress (1): 2.2/2.9 MBProgress (1): 2.2/2.9 MBProgress (1): 2.3/2.9 MBProgress (1): 2.3/2.9 MBProgress (1): 2.3/2.9 MBProgress (1): 2.3/2.9 MBProgress (1): 2.3/2.9 MBProgress (1): 2.3/2.9 MBProgress (1): 2.4/2.9 MBProgress (1): 2.4/2.9 MBProgress (1): 2.4/2.9 MBProgress (1): 2.4/2.9 MBProgress (1): 2.4/2.9 MBProgress (1): 2.4/2.9 MBProgress (1): 2.5/2.9 MBProgress (1): 2.5/2.9 MBProgress (1): 2.5/2.9 MBProgress (1): 2.5/2.9 MBProgress (1): 2.5/2.9 MBProgress (1): 2.5/2.9 MBProgress (1): 2.6/2.9 MBProgress (1): 2.6/2.9 MBProgress (1): 2.6/2.9 MBProgress (1): 2.6/2.9 MBProgress (1): 2.6/2.9 MBProgress (1): 2.6/2.9 MBProgress (1): 2.7/2.9 MBProgress (1): 2.7/2.9 MBProgress (1): 2.7/2.9 MBProgress (1): 2.7/2.9 MBProgress (1): 2.7/2.9 MBProgress (1): 2.7/2.9 MBProgress (1): 2.8/2.9 MBProgress (1): 2.8/2.9 MBProgress (1): 2.8/2.9 MBProgress (1): 2.8/2.9 MBProgress (1): 2.8/2.9 MBProgress (1): 2.8/2.9 MBProgress (1): 2.9 MB                        Downloaded from central: https://repo.maven.apache.org/maven2/org/apache/maven/surefire/surefire-shared-utils/3.5.3/surefire-shared-utils-3.5.3.jar (2.9 MB at 5.4 MB/s)
[INFO] Using auto detected provider org.apache.maven.surefire.testng.TestNGProvider
Downloading from central: https://repo.maven.apache.org/maven2/org/apache/maven/surefire/surefire-testng/3.5.3/surefire-testng-3.5.3.pom
Progress (1): 3.9 kB                    Downloaded from central: https://repo.maven.apache.org/maven2/org/apache/maven/surefire/surefire-testng/3.5.3/surefire-testng-3.5.3.pom (3.9 kB at 12 kB/s)
Downloading from central: https://repo.maven.apache.org/maven2/org/apache/maven/surefire/surefire-providers/3.5.3/surefire-providers-3.5.3.pom
Progress (1): 2.5 kB                    Downloaded from central: https://repo.maven.apache.org/maven2/org/apache/maven/surefire/surefire-providers/3.5.3/surefire-providers-3.5.3.pom (2.5 kB at 67 kB/s)
Downloading from central: https://repo.maven.apache.org/maven2/org/apache/maven/surefire/common-java5/3.5.3/common-java5-3.5.3.pom
Progress (1): 3.1 kB                    Downloaded from central: https://repo.maven.apache.org/maven2/org/apache/maven/surefire/common-java5/3.5.3/common-java5-3.5.3.pom (3.1 kB at 69 kB/s)
Downloading from central: https://repo.maven.apache.org/maven2/org/apache/maven/surefire/surefire-testng-utils/3.5.3/surefire-testng-utils-3.5.3.pom
Progress (1): 3.1 kB                    Downloaded from central: https://repo.maven.apache.org/maven2/org/apache/maven/surefire/surefire-testng-utils/3.5.3/surefire-testng-utils-3.5.3.pom (3.1 kB at 69 kB/s)
Downloading from central: https://repo.maven.apache.org/maven2/org/apache/maven/surefire/surefire-grouper/3.5.3/surefire-grouper-3.5.3.pom
Progress (1): 3.7 kB                    Downloaded from central: https://repo.maven.apache.org/maven2/org/apache/maven/surefire/surefire-grouper/3.5.3/surefire-grouper-3.5.3.pom (3.7 kB at 122 kB/s)
Downloading from central: https://repo.maven.apache.org/maven2/org/apache/maven/surefire/surefire-testng/3.5.3/surefire-testng-3.5.3.jar
Progress (1): 16/47 kBProgress (1): 33/47 kBProgress (1): 47 kB                      Downloaded from central: https://repo.maven.apache.org/maven2/org/apache/maven/surefire/surefire-testng/3.5.3/surefire-testng-3.5.3.jar (47 kB at 467 kB/s)
Downloading from central: https://repo.maven.apache.org/maven2/org/apache/maven/surefire/common-java5/3.5.3/common-java5-3.5.3.jar
Downloading from central: https://repo.maven.apache.org/maven2/org/apache/maven/surefire/surefire-testng-utils/3.5.3/surefire-testng-utils-3.5.3.jar
Downloading from central: https://repo.maven.apache.org/maven2/org/apache/maven/surefire/surefire-grouper/3.5.3/surefire-grouper-3.5.3.jar
Progress (1): 16/18 kBProgress (1): 18 kB   Progress (2): 18 kB | 16/40 kBProgress (2): 18 kB | 33/40 kBProgress (2): 18 kB | 40 kB   Progress (3): 18 kB | 40 kB | 14 kB                                   Downloaded from central: https://repo.maven.apache.org/maven2/org/apache/maven/surefire/common-java5/3.5.3/common-java5-3.5.3.jar (18 kB at 463 kB/s)
Downloaded from central: https://repo.maven.apache.org/maven2/org/apache/maven/surefire/surefire-testng-utils/3.5.3/surefire-testng-utils-3.5.3.jar (14 kB at 343 kB/s)
Downloaded from central: https://repo.maven.apache.org/maven2/org/apache/maven/surefire/surefire-grouper/3.5.3/surefire-grouper-3.5.3.jar (40 kB at 984 kB/s)
[INFO] 
[INFO] -------------------------------------------------------
[INFO]  T E S T S
[INFO] -------------------------------------------------------
[INFO] Running TestSuite
On stertTest
>> Test is started: testLogin
>> On Test Success: testLogin
>> Test is started: addProductToCart
true
>> On Test Success: addProductToCart
>> Test is started: myCart
>> On Test Success: myCart
>> Test is started: checkOutItemTest
British Indian Ocean Territory
India
>> On test skipped: checkOutItemTest
>> Test is started: checkOutItemTest
>> On Test Failure: checkOutItemTest
Screenshot saved at: E:\Udemy Selenium New Start 22_10_2024\Workspace\PurchaseAProductEnd-To-End\.\Screenshot\checkOutItemTest_20250511_213968.png
>> Test is started: confirmPageTest
>> On Test Success: confirmPageTest
on finishTest
[ERROR] Tests run: 6, Failures: 1, Errors: 0, Skipped: 1, Time elapsed: 107.2 s <<< FAILURE! -- in TestSuite
[ERROR] anujpal.PurchaseAProductEnd_To_End.CheckOutTest.checkOutItemTest -- Time elapsed: 30.41 s <<< FAILURE!
org.openqa.selenium.json.JsonException: 
java.lang.reflect.InvocationTargetException
Build info: version: '4.31.0', revision: '1ef9f18787*'
System info: os.name: 'Windows 10', os.arch: 'amd64', os.version: '10.0', java.version: '17.0.12'
Driver info: org.openqa.selenium.chrome.ChromeDriver
Command: [e6361541e034e744ac5a6cec60fb1956, actions {actions=[org.openqa.selenium.interactions.Sequence@697a0948, org.openqa.selenium.interactions.Sequence@7cf63b9a]}]
Capabilities {acceptInsecureCerts: false, browserName: chrome, browserVersion: 131.0.6778.267, chrome: {chromedriverVersion: 131.0.6778.264 (2d05e315153..., userDataDir: C:\Users\loveno\AppData\Loc...}, fedcm:accounts: true, goog:chromeOptions: {debuggerAddress: localhost:50181}, networkConnectionEnabled: false, pageLoadStrategy: normal, platformName: windows, proxy: Proxy(), se:cdp: ws://localhost:50181/devtoo..., se:cdpVersion: 131.0.6778.267, setWindowRect: true, strictFileInteractability: false, timeouts: {implicit: 0, pageLoad: 300000, script: 30000}, unhandledPromptBehavior: dismiss and notify, webauthn:extension:credBlob: true, webauthn:extension:largeBlob: true, webauthn:extension:minPinLength: true, webauthn:extension:prf: true, webauthn:virtualAuthenticators: true}
Session ID: e6361541e034e744ac5a6cec60fb1956
	at org.openqa.selenium.json.JsonOutput.convertUsingMethod(JsonOutput.java:520)
	at org.openqa.selenium.json.JsonOutput.lambda$new$16(JsonOutput.java:182)
	at org.openqa.selenium.json.JsonOutput.write0(JsonOutput.java:409)
	at org.openqa.selenium.json.JsonOutput.lambda$new$22(JsonOutput.java:204)
	at java.base/java.util.stream.ForEachOps$ForEachOp$OfRef.accept(ForEachOps.java:183)
	at java.base/java.util.stream.ReferencePipeline$2$1.accept(ReferencePipeline.java:179)
	at java.base/java.util.Iterator.forEachRemaining(Iterator.java:133)
	at java.base/java.util.Spliterators$IteratorSpliterator.forEachRemaining(Spliterators.java:1845)
	at java.base/java.util.stream.AbstractPipeline.copyInto(AbstractPipeline.java:509)
	at java.base/java.util.stream.AbstractPipeline.wrapAndCopyInto(AbstractPipeline.java:499)
	at java.base/java.util.stream.ForEachOps$ForEachOp.evaluateSequential(ForEachOps.java:150)
	at java.base/java.util.stream.ForEachOps$ForEachOp$OfRef.evaluateSequential(ForEachOps.java:173)
	at java.base/java.util.stream.AbstractPipeline.evaluate(AbstractPipeline.java:234)
	at java.base/java.util.stream.ReferencePipeline.forEach(ReferencePipeline.java:596)
	at org.openqa.selenium.json.JsonOutput.lambda$new$23(JsonOutput.java:204)
	at org.openqa.selenium.json.JsonOutput.write0(JsonOutput.java:409)
	at org.openqa.selenium.json.JsonOutput.lambda$new$24(JsonOutput.java:222)
	at java.base/java.util.Map.forEach(Map.java:713)
	at org.openqa.selenium.json.JsonOutput.lambda$new$25(JsonOutput.java:217)
	at org.openqa.selenium.json.JsonOutput.write0(JsonOutput.java:409)
	at org.openqa.selenium.json.JsonOutput.write(JsonOutput.java:400)
	at org.openqa.selenium.json.Json.toJson(Json.java:133)
	at org.openqa.selenium.json.Json.toJson(Json.java:119)
	at org.openqa.selenium.remote.codec.AbstractHttpCommandCodec.encode(AbstractHttpCommandCodec.java:236)
	at org.openqa.selenium.remote.codec.AbstractHttpCommandCodec.encode(AbstractHttpCommandCodec.java:109)
	at org.openqa.selenium.remote.HttpCommandExecutor.execute(HttpCommandExecutor.java:203)
	at org.openqa.selenium.remote.service.DriverCommandExecutor.invokeExecute(DriverCommandExecutor.java:216)
	at org.openqa.selenium.remote.service.DriverCommandExecutor.execute(DriverCommandExecutor.java:174)
	at org.openqa.selenium.remote.RemoteWebDriver.execute(RemoteWebDriver.java:545)
	at org.openqa.selenium.remote.RemoteWebDriver.perform(RemoteWebDriver.java:631)
	at org.openqa.selenium.interactions.Actions$BuiltAction.perform(Actions.java:616)
	at anujpal.PurchaseAProductEnd_To_End.CheckOutPage.country(CheckOutPage.java:42)
	at anujpal.PurchaseAProductEnd_To_End.CheckOutTest.checkOutItemTest(CheckOutTest.java:11)
	at java.base/jdk.internal.reflect.NativeMethodAccessorImpl.invoke0(Native Method)
	at java.base/jdk.internal.reflect.NativeMethodAccessorImpl.invoke(NativeMethodAccessorImpl.java:77)
	at java.base/jdk.internal.reflect.DelegatingMethodAccessorImpl.invoke(DelegatingMethodAccessorImpl.java:43)
	at java.base/java.lang.reflect.Method.invoke(Method.java:568)
	at org.testng.internal.invokers.MethodInvocationHelper.invokeMethod(MethodInvocationHelper.java:141)
	at org.testng.internal.invokers.TestInvoker.invokeMethod(TestInvoker.java:687)
	at org.testng.internal.invokers.TestInvoker.retryFailed(TestInvoker.java:269)
	at org.testng.internal.invokers.MethodRunner.runInSequence(MethodRunner.java:76)
	at org.testng.internal.invokers.TestInvoker$MethodInvocationAgent.invoke(TestInvoker.java:995)
	at org.testng.internal.invokers.TestInvoker.invokeTestMethods(TestInvoker.java:203)
	at org.testng.internal.invokers.TestMethodWorker.invokeTestMethods(TestMethodWorker.java:154)
	at org.testng.internal.invokers.TestMethodWorker.run(TestMethodWorker.java:134)
	at java.base/java.util.ArrayList.forEach(ArrayList.java:1511)
	at org.testng.TestRunner.privateRun(TestRunner.java:741)
	at org.testng.TestRunner.run(TestRunner.java:616)
	at org.testng.SuiteRunner.runTest(SuiteRunner.java:421)
	at org.testng.SuiteRunner.runSequentially(SuiteRunner.java:413)
	at org.testng.SuiteRunner.privateRun(SuiteRunner.java:373)
	at org.testng.SuiteRunner.run(SuiteRunner.java:312)
	at org.testng.SuiteRunnerWorker.runSuite(SuiteRunnerWorker.java:52)
	at org.testng.SuiteRunnerWorker.run(SuiteRunnerWorker.java:95)
	at org.testng.TestNG.runSuitesSequentially(TestNG.java:1274)
	at org.testng.TestNG.runSuitesLocally(TestNG.java:1208)
	at org.testng.TestNG.runSuites(TestNG.java:1112)
	at org.testng.TestNG.run(TestNG.java:1079)
	at org.apache.maven.surefire.testng.TestNGExecutor.run(TestNGExecutor.java:308)
	at org.apache.maven.surefire.testng.TestNGXmlTestSuite.execute(TestNGXmlTestSuite.java:71)
	at org.apache.maven.surefire.testng.TestNGProvider.invoke(TestNGProvider.java:113)
	at org.apache.maven.surefire.booter.ForkedBooter.runSuitesInProcess(ForkedBooter.java:385)
	at org.apache.maven.surefire.booter.ForkedBooter.execute(ForkedBooter.java:162)
	at org.apache.maven.surefire.booter.ForkedBooter.run(ForkedBooter.java:507)
	at org.apache.maven.surefire.booter.ForkedBooter.main(ForkedBooter.java:495)
	Suppressed: org.openqa.selenium.json.JsonException: Attempting to close incomplete json stream
Build info: version: '4.31.0', revision: '1ef9f18787*'
System info: os.name: 'Windows 10', os.arch: 'amd64', os.version: '10.0', java.version: '17.0.12'
Driver info: driver.version: RemoteWebDriver
		at org.openqa.selenium.json.JsonOutput.close(JsonOutput.java:431)
		at org.openqa.selenium.json.Json.toJson(Json.java:131)
		... 43 more
Caused by: java.lang.reflect.InvocationTargetException
	at java.base/jdk.internal.reflect.NativeMethodAccessorImpl.invoke0(Native Method)
	at java.base/jdk.internal.reflect.NativeMethodAccessorImpl.invoke(NativeMethodAccessorImpl.java:77)
	at java.base/jdk.internal.reflect.DelegatingMethodAccessorImpl.invoke(DelegatingMethodAccessorImpl.java:43)
	at java.base/java.lang.reflect.Method.invoke(Method.java:568)
	at org.openqa.selenium.json.JsonOutput.convertUsingMethod(JsonOutput.java:516)
	... 64 more
Caused by: org.openqa.selenium.NoSuchElementException: no such element: Unable to locate element: {"method":"xpath","selector":"//input[@placeholder='Select Country']"}
  (Session info: chrome=131.0.6778.267)
For documentation on this error, please visit: https://www.selenium.dev/documentation/webdriver/troubleshooting/errors#no-such-element-exception
Build info: version: '4.31.0', revision: '1ef9f18787*'
System info: os.name: 'Windows 10', os.arch: 'amd64', os.version: '10.0', java.version: '17.0.12'
Driver info: org.openqa.selenium.chrome.ChromeDriver
Command: [e6361541e034e744ac5a6cec60fb1956, findElement {using=xpath, value=//input[@placeholder='Select Country']}]
Capabilities {acceptInsecureCerts: false, browserName: chrome, browserVersion: 131.0.6778.267, chrome: {chromedriverVersion: 131.0.6778.264 (2d05e315153..., userDataDir: C:\Users\loveno\AppData\Loc...}, fedcm:accounts: true, goog:chromeOptions: {debuggerAddress: localhost:50181}, networkConnectionEnabled: false, pageLoadStrategy: normal, platformName: windows, proxy: Proxy(), se:cdp: ws://localhost:50181/devtoo..., se:cdpVersion: 131.0.6778.267, setWindowRect: true, strictFileInteractability: false, timeouts: {implicit: 0, pageLoad: 300000, script: 30000}, unhandledPromptBehavior: dismiss and notify, webauthn:extension:credBlob: true, webauthn:extension:largeBlob: true, webauthn:extension:minPinLength: true, webauthn:extension:prf: true, webauthn:virtualAuthenticators: true}
Session ID: e6361541e034e744ac5a6cec60fb1956
	at java.base/jdk.internal.reflect.NativeConstructorAccessorImpl.newInstance0(Native Method)
	at java.base/jdk.internal.reflect.NativeConstructorAccessorImpl.newInstance(NativeConstructorAccessorImpl.java:77)
	at java.base/jdk.internal.reflect.DelegatingConstructorAccessorImpl.newInstance(DelegatingConstructorAccessorImpl.java:45)
	at java.base/java.lang.reflect.Constructor.newInstanceWithCaller(Constructor.java:499)
	at java.base/java.lang.reflect.Constructor.newInstance(Constructor.java:480)
	at org.openqa.selenium.remote.ErrorCodec.decode(ErrorCodec.java:167)
	at org.openqa.selenium.remote.codec.w3c.W3CHttpResponseCodec.decode(W3CHttpResponseCodec.java:138)
	at org.openqa.selenium.remote.codec.w3c.W3CHttpResponseCodec.decode(W3CHttpResponseCodec.java:50)
	at org.openqa.selenium.remote.HttpCommandExecutor.execute(HttpCommandExecutor.java:215)
	at org.openqa.selenium.remote.service.DriverCommandExecutor.invokeExecute(DriverCommandExecutor.java:216)
	at org.openqa.selenium.remote.service.DriverCommandExecutor.execute(DriverCommandExecutor.java:174)
	at org.openqa.selenium.remote.RemoteWebDriver.execute(RemoteWebDriver.java:545)
	at org.openqa.selenium.remote.ElementLocation$ElementFinder$2.findElement(ElementLocation.java:165)
	at org.openqa.selenium.remote.ElementLocation.findElement(ElementLocation.java:59)
	at org.openqa.selenium.remote.RemoteWebDriver.findElement(RemoteWebDriver.java:368)
	at org.openqa.selenium.remote.RemoteWebDriver.findElement(RemoteWebDriver.java:362)
	at org.openqa.selenium.support.pagefactory.DefaultElementLocator.findElement(DefaultElementLocator.java:68)
	at org.openqa.selenium.support.pagefactory.internal.LocatingElementHandler.invoke(LocatingElementHandler.java:38)
	at jdk.proxy2/jdk.proxy2.$Proxy15.getWrappedElement(Unknown Source)
	at org.openqa.selenium.interactions.PointerInput$Origin.asArg(PointerInput.java:262)
	at org.openqa.selenium.interactions.PointerInput$Move.encode(PointerInput.java:211)
	at org.openqa.selenium.interactions.Sequence.encode(Sequence.java:74)
	at org.openqa.selenium.interactions.Sequence.toJson(Sequence.java:83)
	... 69 more

[INFO] 
[INFO] Results:
[INFO] 
[ERROR] Failures: 
[ERROR] anujpal.PurchaseAProductEnd_To_End.CheckOutTest.checkOutItemTest
[INFO]   Run 1: PASS
[ERROR]   Run 2: CheckOutTest.checkOutItemTest:11 » Json java.lang.reflect.InvocationTargetException
Build info: version: '4.31.0', revision: '1ef9f18787*'
System info: os.name: 'Windows 10', os.arch: 'amd64', os.version: '10.0', java.version: '17.0.12'
Driver info: org.openqa.selenium.chrome.ChromeDriver
Command: [e6361541e034e744ac5a6cec60fb1956, actions {actions=[org.openqa.selenium.interactions.Sequence@697a0948, org.openqa.selenium.interactions.Sequence@7cf63b9a]}]
Capabilities {acceptInsecureCerts: false, browserName: chrome, browserVersion: 131.0.6778.267, chrome: {chromedriverVersion: 131.0.6778.264 (2d05e315153..., userDataDir: C:\Users\loveno\AppData\Loc...}, fedcm:accounts: true, goog:chromeOptions: {debuggerAddress: localhost:50181}, networkConnectionEnabled: false, pageLoadStrategy: normal, platformName: windows, proxy: Proxy(), se:cdp: ws://localhost:50181/devtoo..., se:cdpVersion: 131.0.6778.267, setWindowRect: true, strictFileInteractability: false, timeouts: {implicit: 0, pageLoad: 300000, script: 30000}, unhandledPromptBehavior: dismiss and notify, webauthn:extension:credBlob: true, webauthn:extension:largeBlob: true, webauthn:extension:minPinLength: true, webauthn:extension:prf: true, webauthn:virtualAuthenticators: true}
Session ID: e6361541e034e744ac5a6cec60fb1956
[INFO] 
[INFO] 
[ERROR] Tests run: 5, Failures: 1, Errors: 0, Skipped: 0
[INFO] 
[INFO] ------------------------------------------------------------------------
[INFO] BUILD FAILURE
[INFO] ------------------------------------------------------------------------
[INFO] Total time:  01:58 min
[INFO] Finished at: 2025-05-11T21:39:34+05:30
[INFO] ------------------------------------------------------------------------
[ERROR] Failed to execute goal org.apache.maven.plugins:maven-surefire-plugin:3.5.3:test (default-test) on project PurchaseAProductEnd-To-End: There are test failures.
[ERROR] 
[ERROR] See E:\Udemy Selenium New Start 22_10_2024\Workspace\PurchaseAProductEnd-To-End\target\surefire-reports for the individual test results.
[ERROR] See dump files (if any exist) [date].dump, [date]-jvmRun[N].dump and [date].dumpstream.
[ERROR] -> [Help 1]
[ERROR] 
[ERROR] To see the full stack trace of the errors, re-run Maven with the -e switch.
[ERROR] Re-run Maven using the -X switch to enable full debug logging.
[ERROR] 
[ERROR] For more information about the errors and possible solutions, please read the following articles:
[ERROR] [Help 1] http://cwiki.apache.org/confluence/display/MAVEN/MojoFailureException
